{
  "$schema": "https://json-schema.org/draft/2020-12/schema",
  "$id": "https://raw.githubusercontent.com/fabkho/the-i18n-kit/main/packages/mcp/schema.json",
  "title": "the-i18n-kit project configuration",
  "description": "Configuration for the-i18n-kit. Declare it as i18n-kit.config.ts or .i18n-mcp.json at your project root — both accept this same shape. Every field is optional.",
  "type": "object",
  "properties": {
    "$schema": {
      "type": "string",
      "description": "Path or URL to the JSON schema for IDE autocompletion."
    },
    "framework": {
      "type": "string",
      "description": "Force framework detection instead of auto-detecting from project structure. Any registered adapter name is accepted — the suggestions are the adapters that ship today, not the only permitted values.",
      "examples": [
        "nuxt",
        "laravel",
        "generic",
        "vue",
        "react"
      ]
    },
    "context": {
      "type": "string",
      "description": "Free-form project background for the agent — business domain, user base, brand voice, anything that helps the agent understand the project."
    },
    "layerRules": {
      "type": "array",
      "items": {
        "type": "object",
        "properties": {
          "layer": {
            "type": "string",
            "description": "Layer name (e.g., 'root', 'app-admin', 'app-shop', 'lang')."
          },
          "description": {
            "type": "string",
            "description": "What this layer contains — key namespaces, domain scope, etc."
          },
          "when": {
            "type": "string",
            "description": "Natural-language rule describing when a key should go in this layer."
          }
        },
        "required": [
          "layer",
          "description",
          "when"
        ],
        "additionalProperties": false
      },
      "description": "Rules that help the agent decide which layer a new translation key belongs to. The agent interprets the natural-language 'when' field."
    },
    "glossary": {
      "type": "object",
      "propertyNames": {
        "type": "string"
      },
      "additionalProperties": {
        "type": "string"
      },
      "description": "Term dictionary for consistent translations. Keys are source terms, values describe the required translation or usage note."
    },
    "translationPrompt": {
      "type": "string",
      "description": "System prompt prepended to all translation requests (provider mode and agent-mode fallback contexts). Sets tone, style, and constraints."
    },
    "localeNotes": {
      "type": "object",
      "propertyNames": {
        "type": "string"
      },
      "additionalProperties": {
        "type": "string"
      },
      "description": "Per-locale context included in translation prompts. Keys are locale codes (e.g., 'de-DE', 'en-US', 'de-DE-formal'), values describe register, regional conventions, or other locale-specific guidance."
    },
    "examples": {
      "type": "array",
      "items": {
        "type": "object",
        "properties": {
          "key": {
            "type": "string",
            "description": "The dot-path translation key this example demonstrates (e.g., 'common.actions.save')."
          },
          "note": {
            "type": "string",
            "description": "Optional style comment shown alongside the example."
          }
        },
        "required": [
          "key"
        ],
        "additionalProperties": {
          "type": "string"
        },
        "description": "A single translation example. 'key' holds the dot-path translation key (e.g., 'common.actions.save'), 'note' an optional style comment, and every other property is a locale code (e.g., 'de-DE', 'en-US') mapped to its translated value."
      },
      "description": "Few-shot translation examples that demonstrate the project's style. The agent uses these as reference when generating translations."
    },
    "orphanScan": {
      "type": "object",
      "propertyNames": {
        "type": "string"
      },
      "additionalProperties": {
        "type": "object",
        "properties": {
          "ignorePatterns": {
            "type": "array",
            "items": {
              "type": "string"
            },
            "description": "Glob patterns for translation keys to exclude from orphan detection (e.g., \"common.datetime.months.*\"). Use * to match a single key segment, ** to match any depth."
          }
        },
        "additionalProperties": {}
      },
      "description": "Per-layer configuration for orphan key detection. Map each layer name to its settings. Scan directories are automatically determined from each layer's root directory."
    },
    "localeDirs": {
      "type": "array",
      "items": {
        "anyOf": [
          {
            "type": "string",
            "minLength": 1,
            "description": "Relative path to a locale directory. Layer name defaults to 'default'."
          },
          {
            "type": "object",
            "properties": {
              "path": {
                "type": "string",
                "minLength": 1,
                "description": "Relative path to a locale directory."
              },
              "layer": {
                "type": "string",
                "minLength": 1,
                "description": "Layer name for this locale directory."
              }
            },
            "required": [
              "path",
              "layer"
            ],
            "additionalProperties": false
          }
        ]
      },
      "description": "Locale directories for the generic adapter. Each entry is a path string (layer defaults to 'default') or an object with 'path' and 'layer' properties."
    },
    "defaultLocale": {
      "type": "string",
      "minLength": 1,
      "description": "Default locale code. Required for generic adapter activation."
    },
    "locales": {
      "type": "array",
      "items": {
        "type": "string",
        "minLength": 1
      },
      "description": "Explicit list of locale codes to operate on. If absent, locales are auto-discovered from files on disk."
    },
    "protectedLocales": {
      "type": "array",
      "items": {
        "type": "string",
        "minLength": 1
      },
      "description": "Human-maintained locales excluded from automatic translation. Entries may be any locale ref (code, language tag, or file name); entries that do not match a known locale are ignored with a warning. Explicitly naming a protected locale in targetLocales overrides the protection (with a warning)."
    },
    "reportOutput": {
      "anyOf": [
        {
          "type": "boolean",
          "const": true,
          "description": "Set to true to write reports to the default '.i18n-reports/' directory."
        },
        {
          "type": "string",
          "minLength": 1,
          "description": "Custom directory path (relative to project root) where diagnostic tool reports are written."
        }
      ],
      "description": "Enable file output for diagnostic tools (get_missing_translations, search_translations, find_orphan_keys, find_undefined_keys). When set, each tool writes its full JSON report to <reportOutput>/<toolName>.json and returns only a summary in the MCP response. Set to true for the default '.i18n-reports/' directory, or a string for a custom path."
    },
    "localeFileFormat": {
      "type": "string",
      "enum": [
        "json",
        "php-array"
      ],
      "description": "Override the auto-detected locale file format. Useful when both formats exist or auto-detection picks wrong."
    },
    "providerBaseUrl": {
      "type": "string",
      "minLength": 1,
      "description": "Base URL for the LLM provider — gateways, self-hosted model servers and corporate proxies that speak the provider's own protocol. Overrides the endpoint only, not the request shape or auth header. Overridden by the I18N_BASE_URL environment variable and by --baseUrl. Not supported by the \"google\" provider, which rejects it rather than ignoring it."
    },
    "samplingPreferences": {
      "deprecated": true,
      "description": "Deprecated and ignored — MCP sampling was removed. Still accepted so existing config files keep validating. Configure a provider instead (e.g., I18N_PROVIDER/I18N_MODEL)."
    }
  },
  "additionalProperties": false
}
